{
  "$schema": "../../schema/collection.schema.json",
  "name": "Comment",
  "schema": {
    "bid": {
      "type": "uniqueId",
      "required": true
    },
    "uid": {
      "type": "uniqueId",
      "required": true
    },
    "content": {
      "type": "string",
      "required": true,
      "trim": true,
      "validator": "^.{1,}$"
    },
    "createdAt": {
      "type": "date",
      "required": true,
      "immutable": true,
      "default": "now"
    }
  },
  "indexes": [{ "keys": { "bid": 1, "createdAt": -1 } }, { "keys": { "uid": 1, "createdAt": -1 } }],
  "relations": [
    { "collection": "Blog", "localField": "bid", "foreignField": "bid" },
    { "collection": "User", "localField": "uid", "foreignField": "uid" }
  ]
}
